{
  "schema": "gummy.place-activation-registry/v1",
  "id": "place-activation-registry:gummy-os:phase15",
  "baseRegistry": "place-registry:gummy-os:first-party",
  "generatedAt": "2026-07-28T23:56:00.000Z",
  "places": [
    {
      "placeId": "app:gummy-channels",
      "coreAvailability": "available",
      "coreCapabilities": ["channel-guide.manage", "watch-groups.manage", "family-room.compose", "premiere-draft.prepare"],
      "capabilityStates": [
        { "id": "channel-guide.manage", "availability": "available", "startsExecution": false, "releaseTruth": "Create and maintain local channel, episode, favorite, and guide records." },
        { "id": "watch-groups.manage", "availability": "available", "startsExecution": false, "releaseTruth": "Create Human-defined watch groups without an algorithmic feed." },
        { "id": "family-room.compose", "availability": "available", "startsExecution": false, "releaseTruth": "Create bounded bulletin notes; no open chat is implied." },
        { "id": "premiere-draft.prepare", "availability": "approval-required", "startsExecution": false, "releaseTruth": "Prepare and approve a local premiere draft without publishing it." },
        { "id": "channels.android.open", "availability": "mobile-companion-required", "startsExecution": false, "releaseTruth": "Open the installed Gummy Channels compatibility build through its exact native route." },
        { "id": "channel.publish", "availability": "remote-service-required", "startsExecution": true, "releaseTruth": "Remote publication remains unavailable until the Channels service and moderation system are verified." }
      ],
      "connectionRoutes": [
        { "kind": "android", "route": "gummy-channels://open", "status": "available" },
        { "kind": "remote-service", "route": null, "status": "needs-setup" }
      ],
      "lastVerifiedAt": "2026-07-28T23:52:00.000Z",
      "releaseTruth": "The local guide and installed Android route work now. Remote publication still needs the Channels service and production signing."
    },
    {
      "placeId": "app:gummy-wardrobe",
      "coreAvailability": "available",
      "coreCapabilities": ["wardrobe.items.manage", "outfit.compose", "availability.update", "outfit.export"],
      "capabilityStates": [
        { "id": "wardrobe.items.manage", "availability": "available", "startsExecution": false, "releaseTruth": "Add, edit, organize, and remove confirmed owned items." },
        { "id": "outfit.compose", "availability": "available", "startsExecution": false, "releaseTruth": "Compile and save one owned-item-first outfit." },
        { "id": "availability.update", "availability": "available", "startsExecution": false, "releaseTruth": "Mark an item unavailable without turning it into a dislike." },
        { "id": "outfit.export", "availability": "approval-required", "startsExecution": false, "releaseTruth": "Export only the selected outfit and its item references." },
        { "id": "item.capture.camera", "availability": "mobile-companion-required", "startsExecution": false, "releaseTruth": "Manual entry works now; camera classification needs a mobile capture capability." },
        { "id": "shopping.checkout", "availability": "blocked", "startsExecution": true, "releaseTruth": "Wardrobe has no checkout or autonomous purchase capability." }
      ],
      "releaseTruth": "Owned-item management, outfit composition, temporary availability, history, and selected-outfit export work locally. Camera classification needs a companion."
    },
    {
      "placeId": "app:gummy-house",
      "coreAvailability": "available",
      "coreCapabilities": ["house.projection.manage", "intent.preview", "two-note.commit", "house.export"],
      "capabilityStates": [
        { "id": "house.projection.manage", "availability": "available", "startsExecution": false, "releaseTruth": "Maintain a scoped local projection of rooms, observations, and projects." },
        { "id": "intent.preview", "availability": "available", "startsExecution": false, "releaseTruth": "Preview exactly what crosses the Scope Wall." },
        { "id": "two-note.commit", "availability": "approval-required", "startsExecution": false, "releaseTruth": "Commit intent and consequence together with a Place receipt." },
        { "id": "house.export", "availability": "approval-required", "startsExecution": false, "releaseTruth": "Export selected House records without address or ambient photos." },
        { "id": "homewright.open", "availability": "available", "startsExecution": false, "releaseTruth": "Open the verified full House workbench and import only the exact Human-approved two-note commit." }
      ],
      "connectionRoutes": [
        { "kind": "web", "route": "https://homewright.vercel.app/", "status": "available" }
      ],
      "lastVerifiedAt": "2026-07-28T23:56:00.000Z",
      "releaseTruth": "Scoped House memory, the Intent Gate, and the verified full workbench are connected through exact two-note commit receipts."
    },
    {
      "placeId": "app:gummy-worlds",
      "coreAvailability": "available",
      "coreCapabilities": ["world-plan.manage", "world.validate", "world.estimate", "world.inspect", "world.package", "world.duplicate", "sit.preview"],
      "capabilityStates": [
        { "id": "world-plan.manage", "availability": "available", "startsExecution": false, "releaseTruth": "Create and edit structured World Plans." },
        { "id": "world.validate", "availability": "available", "startsExecution": false, "releaseTruth": "Validate sources, operations, and constraints without execution." },
        { "id": "world.estimate", "availability": "available", "startsExecution": false, "releaseTruth": "Compute a bounded local estimate; no provider is contacted." },
        { "id": "world.inspect", "availability": "available", "startsExecution": false, "releaseTruth": "Inspect the exact structured plan and history." },
        { "id": "world.package", "availability": "approval-required", "startsExecution": false, "releaseTruth": "Export a versioned World Plan package." },
        { "id": "world.duplicate", "availability": "available", "startsExecution": false, "releaseTruth": "Create an isolated revision-one copy." },
        { "id": "sit.preview", "availability": "available", "startsExecution": false, "releaseTruth": "Preview the supported Sit experience configuration." },
        { "id": "worlds.studio.open", "availability": "available", "startsExecution": false, "releaseTruth": "Open the full Worlds Studio and import the exact bounded plan without starting native construction." },
        { "id": "make_world", "availability": "local-runtime-required", "startsExecution": true, "releaseTruth": "Only real scene construction requires Meshmallow." },
        { "id": "walk.preview", "availability": "approval-required", "startsExecution": false, "releaseTruth": "Walk remains a separately gated experience." }
      ],
      "connectionRoutes": [
        { "kind": "web", "route": "https://videoworldsnet.vercel.app/create", "status": "available" },
        { "kind": "local-bridge", "route": "http://127.0.0.1:5214", "status": "needs-setup" }
      ],
      "lastVerifiedAt": "2026-07-28T23:53:00.000Z",
      "releaseTruth": "World planning and the full Worlds Studio are connected through exact bounded-plan receipts. Only real 3D construction needs Meshmallow."
    },
    {
      "placeId": "app:gummy-table",
      "coreAvailability": "available",
      "coreCapabilities": ["table.manage", "invite.manage", "rsvp.manage", "rules.acknowledge", "dishes.manage", "pantry.gift", "table.export"],
      "capabilityStates": [
        { "id": "table.manage", "availability": "available", "startsExecution": false, "releaseTruth": "Create and preserve an invite-only Table." },
        { "id": "invite.manage", "availability": "available", "startsExecution": false, "releaseTruth": "Create private invitation records; no discovery is created." },
        { "id": "rsvp.manage", "availability": "available", "startsExecution": false, "releaseTruth": "Record yes, no, or maybe for an invited participant." },
        { "id": "rules.acknowledge", "availability": "available", "startsExecution": false, "releaseTruth": "Record Table Rules acknowledgement without ideological profiling." },
        { "id": "dishes.manage", "availability": "available", "startsExecution": false, "releaseTruth": "Coordinate dishes for the selected Table." },
        { "id": "pantry.gift", "availability": "available", "startsExecution": false, "releaseTruth": "Record gifts without balance, debt, score, or exchange rate." },
        { "id": "table.export", "availability": "approval-required", "startsExecution": false, "releaseTruth": "Export the selected Table without an exact address." },
        { "id": "address.release", "availability": "remote-service-required", "startsExecution": true, "releaseTruth": "Exact address release requires the verified civic service." }
      ],
      "releaseTruth": "Private Table planning, invitations, RSVPs, rules, dishes, Pantry gifts, and export work locally. Exact-address release needs the verified service."
    },
    {
      "placeId": "app:gummy-radio",
      "coreAvailability": "available",
      "coreCapabilities": ["source-package.import", "script.revise", "script.approve", "speech.preview", "episode.export"],
      "capabilityStates": [
        { "id": "source-package.import", "availability": "available", "startsExecution": false, "releaseTruth": "Import only exact selected sources and exclusions." },
        { "id": "script.revise", "availability": "available", "startsExecution": false, "releaseTruth": "Create revisions and invalidate stale approvals." },
        { "id": "script.approve", "availability": "approval-required", "startsExecution": false, "releaseTruth": "Approve the exact script revision." },